und isch glòübi no schtänderaat gsi	LU
also ä näbed näbed irem huus zue isch namal es huus vo dère rees	ZH
i weis no es isch glouben i am samschtig am aabig gsii wenn s gfrüe ghaa	BE
in ittaalie unde	BE
sämtlichi maass müese khenne	BS
schòggi hets dòch ggää ainisch im monet het mer chönne schòggi chauffe	LU
das das isch lang gange da isch e halb joor isch die behandlig do gange	BS
das isch aues üsi aarbeit gsii mi hei auso	BE
ìsch deet in abdrùkt woorde	LU
ich han also zimlichen iifluss ghaa	ZH
hei miir si ds mueti het de die zäni u die zwänzgi vo däm serwisgält het es alls uf d sitte taa	BE
aso de dr redüigedanggen ìsch ìsch algeegenwèrtig gsìì würdi saage also schpeziel bi uns wilmers diräggt	BS
das sind dänk eso	ZH
er isch wiiter uf das uurdoorf am suntig mit miinere mueter	ZH
de nichtangrifspakt schtalin hitler nid waar	ZH
si isch glaub i als ainzigi schwizeri	BS
bin grad sibezgi gsii rächned sii s uus	ZH
widere e paar schrit gloffe ghèi ì wider um aifacht plözlech zämegsaket	LU
nume daas dèète mache und ìch wird das	BS
mer händ d maass möse khenne vo dene	BS
wo veschtändlich isch	ZH
ùnd unseri raichwaite mit sììbenehalbsantimeetergschǜz	BS
wenigschtens im gränzgebiet	BE
u de	BE
ungefäär joo	BE
und di sii hei aui bewacht woorde	BE
das hät öppis z tue ghaa mit der gwalt und i chumen uf daas	ZH
als wän ich dèè jez gsee aso	ZH
das isch min brüeder gsii und iich dän eben ä na	ZH
mììr nattürlech usen ùnd ab ùnd	LU
ùnd die maischte wen si nìt	BS
grent ha ds gweer zwäggmacht aus u bi näär grent	BE
u gäu mit dene dienschtverweigerer u mit dene uu	BE
ding ghaa für abezloo a so rou	BE
wie reagiirt denn der bundesraat und	BE
händ würklich us däre ganzen armee	ZH
gwise a das	ZH
s isch auerdings schtokfiischter gsii	BE
i möcht mi daadezue nid üssere	BE
me ghööri daa so gschichte dass wäme nöd iiruki schikeds nachhèèr	ZH
jo da isch ganz	BS
ìsch auso achthùndert franke het de gschoschtet	BE
ufglöst worden isch	BS
und de si immer mee zruggplibe	BE
bììni zuen im gange und het ge äär het gse gsee dass das öpper chunt ìch ha gsäit	BS
dòò bin ìch äu überzüügt gsìì ùnd zwaar	BS
der erschti ìsch anno nünzehundertsììbenedriissg am fümfte märz geboore jä	BS
und dene han ìch gsäit	BS
wais nid eb mer doo uberhòüpt aini ghaa hend	LU
gganz iidrǜklìch gsii i dem auter für nes chìnd	LU
sibezäänen isch si zu dène choo	ZH
topf inegrüert u när het me gluegt was s beschte usechunt	BE
hani nätürch verfolgt aso das froschschhärz	BS
iirüke uufhöre zämepake u iirüke nach frik	BE
s gschäft bhalte	ZH
da isch jo e liäbe proteschtant gsi oder	BS
sälbveschtäntli	ZH
do ìsch e lütnand dert gsìì vìlìcht mìt mìt sim mìt em schaz vìlìcht	BE
aso den hei di beide müettere nìd wölle la gaa aber mir heis eifach	BE
me het vertrout uf uf	BS
und uusgrächnet oisi naachbere händ gsäit s wèèri guet wän de èrnschtli	ZH
und täilwiis sind s lieder gsii vo de wandervogelbewegig wo mer übernoo hät	ZH
vo hie	BE
das ìsch öppe	LU
wo min vatter underschribe hät	ZH
de chrieg	LU
mir si im wäudrand uss gmarschiirt i zwöierkolone	BE
jo d söimer hei zu irne ross gluegt gäl	BE
si isch zwaar nid politisch aber si isch im faupheeodee gsii	ZH
bi mine gebuurt sind si daa i de schwiiz gsii	ZH
mit de soziaaldemokraate und ha gsäit	ZH
jaa mi hei natüürlech uufgaatmet	BE
schlosserleer hät èèr äu bi de signum	ZH
er söu gaa he u hei sich na u gmacht u	BE
döt bin ich also scho zwaiedrissg döt wär i also nünzäjörig gsi he	BS
z lieschtu sind gaar nìd vǜu wiiterchoo	LU
aber also es ìsch esoo gsìì	BS
in iwerdõ bin ich dänn es jaar gsii au inere	ZH
als di andere wie söli jez dem säge	BE
u de han	BE
behäuptet ich han	ZH
das het e drootverhou ggää wo	BE
wo äär uns hèt khöne da die oder jeene aawiisigen oder wünsch bekhant gää	BS
da isch ganz uusgchlammeret woorde	BE
u hei zwee chesseli ghaa	BE
und hät gschriben er heigi	ZH
i ha da schriftlig i ha das sogar zur verfüegig hett i das	BS
was ich daa für für gedanke gmacht han dèè hät	ZH
jòjò insgehaim	LU
si nume no dütschi	BE
u u das meeni un ii mìr hei mìr hei de müesse	BE
gaar nöd aber es isch dän ja langsam	ZH
ggange da das hend si nid viu	LU
jäjä denn het s also jäjä	BS
vo de kriise vo der aarbäitsloosigkäit iegraate und mich seer intressiirt	ZH
und han mis gäld esoo vedient	ZH
vo öisne behöörde vor alem vom bundesraat weniger vom sicher nöd vo der armee	ZH
das muess	BE
ùnd e z basu het mer jò ghaa	LU
won ich die kasetten aaglueget han	ZH
im chèller unde moscht abfülle i i	LU
es ìsch ufeme wäg ìsch das e	BE
nachemene vertraag	BE
öppe füfjäärig	LU
i gloub mer hät nìd emaau arbeit ghaa	BE
wìchtig ìsch dä maa aso deet dure hät ìch amel de schoo	LU
weme heicho isch	BE
ainzelbischpil wie waarschinlìch daas hunderti jò tuusigi	BS
han ììch zum biischpil won ìch nonig i de suuwa ggsìì bìì	LU
oder ùnd mììr hend natüürlìch nìd furt chönne	LU
ùnd äär de maa ìsch lokifüerer gsii ùnd die hend jò al die bileet ghaa	LU
ùnd dää het de die echlii bevoorzùgt ùnd das wemmer das hetis de chli möge mer hend ggsait gopfertoori iez hemmer	LU
das wäis mer jez hinedrii efèngs	ZH
jede mitwuch wäme frei ghaa hät	ZH
also aso vo miim halbbrüeder	ZH
chaarscht uf der achslen ùnd	LU
rächtes vilicht mit underschtüzig im militär	BS
nöi karabiner o grad iigfüert woorde	BE
ar auso in bangerte	BE
dasch en angeri schpraach he	BE
den häi mir das chönne ìì plaane dasmer häi chöne	BS
won i ds eersch mau ha ghaa	BE
wän ich aber lise hinedrii ez öppedie imene biitraag vomene hischtooriker	ZH
nid rächt verschtange was dä gseit het	BE
das si daas als hei laa gschee	BE
zässe chole cho hole	BE
und der eint het gseit er heig e pischtole aber	BE
wobii ja s kwartier natüürlich nüd zum vergliichen isch mit em hütige kwartier	ZH
füre zu üüs in	BE
auui die näme das ìsch für mììch e begrìff gsii	LU
verdùnkle ùnd i chäller het mer ämel mìr sind alli dò obe	LU
ìsch einnglech scho einheitlech gsìì hets mi tünkt	BE
militarismus gsi öppis anders isch für mi gar ned in frog kho	BS
he womme	LU
und schpööter ööschtriich psezt	BE
chöne zu imfermazioone choo	ZH
de ìsch dä uf nöijebuurg gradlet mit em weloo	BE
bi dänn schpööter als chemiikaufmann	ZH
do han i dienscht ghaa	BE
die soldaate me het gsee me het gschpǜǜrt	BS
da het mer döört öppe drin gläse was daa geit	BE
e schwöschter han ich ja	ZH
mitemere richter vom	ZH
isch seerschand gsii was das immer isch ich wäiss es nööd	ZH
de het s aber ou froue ghaa	BE
nä heg schi noo wil poschtwagen inetue aber deet hig s	BE
seer vil es sind jò nò schpeziel im viirzgi	BS
u nächher chunt eine cho fraage de feudwe oder soo	BE
aber die händ ganz enoormen iisaz glaischdet die russe	BS
und di gliich sunntigsschuelleereri han iich dän schpö̀ö̀ter ä ghaa	ZH
aber es isch natüürli daas gsii aso das isch öppis wo ich nümen ärläbt han	ZH
ja ja	ZH
de heimer sofort de saau lò mache	BE
jezt wie täil ich das mine frau mit	ZH
voo won ììch ine chönt es halbduzet uufzelle aber daas goot z lang das wäimer ez lieber nid sääge	BS
ìsch daas mues de chrieg jò dernò miir gsìì	BS
ùnd er het au brieffründe ghaa südameerikaa in bangkok aso de nìd wä	LU
jaa das isch e bürgerlichi wält gsii und das isch	ZH
ich wot käs gweer i d händ nää	ZH
die hät mee überchoo mit dère aarbetsloosikäit waarschindli	ZH
won ich uf d wält choo bin	ZH
miin iisaz min pärsöönlichen iisaz	ZH
ùnd sit doo bini echli ghändikèppiirt ùnd es nümmen eso guet gange	LU
haaltig e schwiizerischi haaltig	ZH
ìch maine dò het mer mǜsse	LU
mit uns ziit di nöie zäit	ZH
ùnd äbe i de zǜriziitig ùnd männgisch sind die ziitige	LU
und ich ha de dienscht mit volem bewusstsii	ZH
nai das ìsch gad zwüsched dasch grad choo nünzehundertvierzwänzg	BS
häi si dehäim e balkoon won er cha dusse si hani gsäit jä	BS
und das isch öppis gsii won i gfunde han mit dem chan ich überhaupt gaar nüüt aafange	ZH
dää nanai dè het aso nüüt mer hend aso nie polittisiert i de schueu nie	LU
ois ganz offen is gsicht gsäit das mer das miir ali zäme	ZH
und desshalb han ich also	BS
überal ggsìì	LU
ìrgendwie abgsee vo dère bedrooig	LU
dann dann brechen wiir mit gawaalt ein	BE
obligatoorisch	LU
ùnd hend de gäl die frau oben a üüs die het i irem	LU
je det wos echli bräntschilig gsii isch	LU
als gedenken a d mobilisazioon sondern macht e gedänkfiir	ZH
im huus inen um s huuse ume	ZH
geografii	BE
het äär dur das chö̀ne mache	BS
ùnd den ìsch s langsam unngmüetlich woorde	BS
echlii chli liechter e	BE
ìch ha daas dörffe mache won ììch ha welle	BS
und mir hei ja pro bateljoon nume zwei iikaa ghaa	BE
und deet drin isch dän choo èèr seig ebe bimene puur gsii	ZH
uf dr waldmansbuurg obe	BS
i dr moospinte	BE
aso mìr sind nìt gflǜchdet phersöönlìch nìt aber seer vil noochbere	BS
d diräkzioon wäär go fraage häts gheisse das geit öich nüüt aa he u hät ou nìd gfragt	BE
sach woo wome wome set öppis sich ussere dezue	BS
mer bruucht mer mues jò nìd immer s aller aller tüürschte haa	LU
ä junge pfaarer natürlig ned us	BS
und choscht u loschii	BE
ùnd hend die usinnig aschträngige gmacht i d schwiiz chenne go z schaffe	LU
u nächer säb ìsch de nächher d ämässaa da si	BE
i äim zimmer hät dänn min	ZH
es wüssed sii wens e schtròòff gsii wäär	LU
und di hei da soo irer persöönliche sache nid und	BE
und häi dene no gjassed und den ìsch gsunge woorde	BS
de het er amig gsait ich mach es ez andersch ich chumen eppen am halbizwöfi gaan ìch	LU
i de e gueti schüeleri gsii bin und vo deet aa	ZH
u näär het me üüs dert la mache	BE
und wifaag a beidnen oorte ha de nächer no gwächslet vo	BE
git s wider e aarbeitsloosigkeit nächäär oder was chunt	BE
nach em dienscht	BE
en föifer hät das koscht schteled si sich emal voor	ZH
häm miir aso doo ruum im baasel hämmer immer nò öppis gège dütschi	BS
se pa mua atò̃ssiò̃ò̃ lèss me drònngil	BS
inwolwiiert woorde mit däm das ìsch aus einnglech	BE
de ghören i wider das öpper redt do	BE
di andere sind wider zwee dinne ggsìì	LU
dä isch sofort het er	LU
und de isch me a d gränze choo	BE
e gueti	BS
wo aber eersch nach viirzig gäled	ZH
mììr hend als chìnd jedes het en öpfubaum ghaa	LU
hǜt luegeds jò uf uf	LU
laager	BE
an dene barikaade womer duure sìì	BS
wo nohäär use ch uuschoo ìsch das das e gips	BS
ùnd den s het me filme ghöört	LU
miteme broot miteme brootramft dòò ab sondern dää wot nò mee	LU
sini mueter hät desswäge duretrület	ZH
wenn der bundesraat nooggä hät	BE
wär vo de regierigsröt au	BS
letschter sicherhäit ooni das mer grooss drüber gredt händ	ZH
vor allim häi miir e unngläublichs vertroue ghaa zum generaal gisãã	BS
mini mueter hät dänn i de zwüscheziit ires gschäft	ZH
wämmer sage isch si denn gflooe nach	BS
den het er gsäit soo jez hesch duu	BS
iiräiche und wird das ales in d oornig mache	BS
en nidere höözuug gsii dört het de puur	BE
was die emigrante i dene laager gässe händ	ZH
das isch naa underschtriche woorde	ZH
ùnd das das eggsperimänt	BS
aso si sìnd wiiter aber wischi deet dùrab ab a d ggootasüür	LU
abgholt hät	ZH
nid wele schtriichen obwol ich em gsäit ha losed si das isch	ZH
tood also z tood beläidiget gsii	ZH
si doch det gsìì wo das gwǜsst hei u u wo öpper si gsìì u nìd tum si gsìì das das	BE
und das häimer den esoo gfunde jä jä das ìsch guet und briima und den bin ìch i d hotelfachschuel nach nöijeburg cho scho wäg de schprooch	BS
uf bäärndüütsch	BE
het mer das sìnd esoo groossi toontö̀pf gsii	LU
han i ha ja ä nid vorane chöne ich bi ja i de chischte ghoket nid waar	ZH
isch miini schwöschter jaa ungefäär	ZH
mhm	ZH
und dän isch es nünzehundertzwölf gsii	ZH
phaktne	LU
bim ggaader oder bi de soldaate	ZH
frienisbäärg das ìsch i dr nööchi vo schüpfe	BS
das isch mr jez wider in sinn choo won ich mit minere bekante gredt han	ZH
d zivilischte mües de plaz verloo	BE
die hend do miesse hai plözlech daa het me dùe scho gsait	LU
u nächer der korporaau het das natiirlech o gmerkt und	BE
ìch waiss	BS
ùnd die hend schiinbar d chìnd seer die hend üüs kaugumi ggää das ìsch natüürlech	LU
im bezirksgefängnis han i die jaa	ZH
en ainzelkhind gsìì ùnd drozdäm ìsch sii also säli ziit ìsch überhäupt	BS
und mer amel esoon en en	ZH
är isch geboore am äinezwänzigschten äuguscht	BS
und hät ä mit miner mueter en ängers verheltnis ghaa und die hät em tuttwiiler en brief gschribe	ZH
wenn schon dänn mus ich	ZH
ich bin	ZH
den auso scho im dienscht	BE
ìch bi doo dehaime ggsìì bi doo uf lùzäärn	LU
esooen e galbe und eson e löffel und esoo und mir gendich wasmer hend	LU
aanegfaare und de norhäär aber da ìsch schpööter gsìì	BS
mir hend und daa die chaarte die militäärchaarte	LU
vonmoos die sind die sind netter gsii di andere sind e chlii	LU
drum sig är doo plibe	BE
döt hèt men e seer e groosse ussländeraatail hütte	BS
ìsch er hai ùnd de hend si mììch in es absonderigshuus tòò ùnd hend mììch deet lò ligge	LU
hei se natüürlech lieber aagnoo	BE
hei mobilisiirt und genou das hei si	BE
ìsch scho es theema gsìì mer het efach gwǜsst ghaa	BE
das si emigrante	ZH
speziaalgattig ggsìì mit der ofziere	LU
brootmärk jò die het mer nie chönnen abgää	LU
äu vo den anderen ofiziir	ZH
damit si nicht könd i d schwiiz flüchte	BE
und mini halbschwöschter	ZH
däne sii wägeneme ùndersuech ùnd de bìni drei wùche däne ggsìì	LU
gschlossni	BE
woo die flieger daamòls alli gflooge händ nìt	BS
was muesi ez säge di sind ez öppe füfefüfzg jaar	LU
und het under anderem het er äbe verzelt er sig schtudänt gsi	LU
dò bin ìch nò ainisch uuf ùnd go dä bäärner marsch lòse de ganz ganz liislig	LU
nohär müesse si de suun nìd furtgee	BS
er het sich nüüt mit däm beschäftiget	BE
ich veschtaa si nö	ZH
oder kwisling ìsch zum bischpil für mììch e begrìff gsii kwisling	LU
und s entschuldigung i schäm mi fascht da sage	BS
isch seer aktiive gwärkschafter gsii bim metalarbäiterverband	ZH
d erlaubnis ghaa für miin eerschten uurlaub wienachtsuurlaub	ZH
und glèèrt echli bärgschtiige der aint isch no ine chlätterkurss	LU
u nächer e monet schiikurs in andermat	BE
und de het mer wider wiitergschaffet am andere	BE
sich es ächt dùe gsii	LU
d schwiiz ìsch d schwiiz ùnd bliibt d schwiiz	LU
jò im kùnschthuus	LU
jò s s ìsch natürch esoo gsìì dass erschtens hèt me	BS
brüüder zur sone zur fräihäit	ZH
am zääte mäi am geburtstaag vo mine frau	ZH
ich mö̀cht mi doo nìd üssere	BS
ich ha son en karton da	ZH
aber det mit dene heimer nie nüüt	BE
vìlìcht vierevierzg gsìì oder dreievierzg	BE
ha gfrogt wohäär si chöimi franzoos	BE
dä isch glèèmt gsii	LU
erfülpaar nid erfülbaar seiged	ZH
ich han a minere wienachtsfiir	ZH
mir si zfrììde gsii me het nüüt anders gwüsst bìsch dankbaar gsìì für ales zäme	BS
aso im mäi juni nüünzeviirzg isch ja die schtimig andersch gsii als im	ZH
han sekundaarschuel gmacht	ZH
kener trupen abziei us der süüdsiite do	BE
die hend rede fascht redeverbot ghaa	LU
und är schtel sìch voor wi iir maine liibe mutter	BS
aber s hät halt sonigi jüüt ggää	ZH
eerzinge choo und da het si gsee das dä esoo e familie het u scho lang ghüraaten isch	BE
nur chani hüt nìd verschtòò das lüüt gììt	LU
ainisch am morge ainisch am nomitaag	LU
da het jede puur het	BE
ìsch also wì ggsait für chìnd ìsch es en eldoraado ggsìì guet für d eltere	LU
das händ s natüli übehaupt nid gwüsst	ZH
sondern e pflìcht	LU
sind chlopfzaiche gsi so dädädädää	LU
aso äienlich scho seer früe raadio gloset	ZH
ùnd der	LU
seer vil lüt i öisem bekhanteggrais händ gsait s ìsch guet	BS
deet ringe und schwinge isch deet öpis ganz	ZH
nai nai	LU
ùnd doorum uusgnoo er het nìd mǜsse dienscht laischte me hetne deet pruucht	LU
dass wì d amerikaaner die hend ou e keni ineglòò ùnd d franzoose	LU
broschüüre vom franz	BS
si der kriig kann jeeden taag fertig sein hä	BE
gits jòò äu hütte nò seer weenig baasler büürger	BS
die nöi gründet worden isch in baasl	BS
hütte dräu ich den amerikhaaner eben alles zue nachdäm me e gwǜsse iibligg ghaa hèt nìt bi zwaiehalb joor	BS
fröölech ùnd	LU
si hei gseit si döörf s si döörf s nume abgää wenn i korporaal sig und das bin i nid gsi	BE
het mer ne müesse schteuue	BE
au anders wì me mit dene belgier umggangen ìsch ùnd mìr hend jò vǜl flǜchtlingschìnd dòò ghaa	LU
wil me mùss doch d haimet eerschtens fǜr d haimet iischtòò	LU
vo und er isch tokter anwalt	LU
für di für für die al die chriegsjaar	BE
näbebii	BS
mi hei dert topfpflanze freiland	BE
zeerscht ìsch bewachig vom baanhoof am ziischtig zoobe	BS
z züri isch doch wäret em chrieg gsii d landi	LU
wo denn verlore gangen isch oder so he	BS
ùnd dää ìsch de mee mìt de buebe ggange	LU
die het me chöne ruig ufnää gäled si und	ZH
när d rekruteschueu gmacht und es jaar	BE
oo jaa seer enorm	ZH
und dän isch emaale schiints chilbi gsii das hät ghäisse rössliriitschuel äi	ZH
d wonig ghaa bin i dä go weke und dä isch toube woorde	BE
isch särviirtochter gsii und hät mit driissgi	ZH
ìch has de scho gschpǜǜrt das mer nümme nümmen eso ganz ghüür ìsch	LU
sii het dernoo	BS
befasst damals oder so sondrern	BS
ùnd händne laaborbläz gää biischpilswiis in baasel	BS
me hed gwüsst dass do öpper isch wo gärn hälfe tuet wo au finanziell	BS
d jùùde si nìd in d reschtorò̃ò̃ gange	BS
s letschteri isch de fall ich bi mir seer bewusst gsii	ZH
luschtigi sache	BE
aber de büürgebäärg ìscht	LU
är ììch wäär gääre adjudant worde eppis soo aber das isch do	LU
gebiet het s kei militäär ghaa isch nume gränzwacht gsii	BE
und dän händ emal d schwöschter d schwöschtere vo minere mueter gsäit	ZH
und chöme cho luege wis goot z gälterchinde	BS
es beschtöön für in d möglechkeit no zruggoo er sägi eifach er hei der koleeg lang nid gfunge	BE
und bi üüs isch si haut au wider uusgwise woorde	BE
als täilnäämer oder soo das ìsch aso	BS
aber de si oo di tütsche	BE
s ääinti mäitli isch nünze	ZH
me hät si	ZH
jä jä das ìsch jä me hets scho gschpüürt	BS
und politischi bildig hämmer ghaa	ZH
under die föif gschwüschterti	ZH
ùnd di lüt die truppe wo in khliibaasel schtazioniirt gsi wääre die hät men aifach müsen ufgää nìt di häte sich jò nìt soo guet chöne vertaidige	BS
mis aaschteligsding gsìì won ìch ghaa ha dehäi	BS
der wittvogel i han öi das vorhär glaub gsait gha hed am drissigschte januar nünzädreiedrissig also an däm tag	BS
dänn hämmer aber au zwäi ööschtriicher ghaa und di händ hauptsächlich	ZH
si hättid ja wärid si waiss nid is konzentrazioonslager cho	LU
aber i wäiss das sìì zuezooge worde si zum schaffe	BS
ts ganz ganz nooch	BS
hei si ufegfunket den englender	BE
jez foort es anders läben aa hä me isch eifacht das us em läbe usegrisse woorde	BE
ja me mues äifacht wüsse ja mer mues ja äifach folgendes wüsse	ZH
und äis zimmer isch esoo win e besseri abschtelchammer gsii	ZH
das wieni scho gsäit ha ìsch	BS
und den won äär dehäim gsìì ìsch	BS
mit chìnd ùnd chegel sìnd die mit chìnderwägen sind die dò uf lùzäärn ine choo	LU
im tüütschuntericht hämmer gwǜssi passaasche	BS
vo der schtänderot wänk regierig wänk isch döt derbi gsi	BS
eine de ìsch gsìì de ìsch i ds tüütsche de ìsch	BE
so mit de zit ebe wie gsäit voorhäär nìt	BS
sìì vo	BS
ìsch de klumpfuess wider choo do het mers nomòl operiert	LU
es ìsch esoo gsii	LU
us dem grund	LU
u no han i gsänkt oha	BE
wo mitgschafft händ	ZH
het er esoo uifzelt zwölf drize jaar schuel ghaa	LU
dò sim mir aso	BS
das isch vilich öppe soo	BE
ìch de kwartiirmaischter wos do no gää het	LU
mit däm französisch z leere als süsch	BE
oond jo	BS
ganz wiiss vo vo vo biecht ùnd	LU
tütschi wo land uf de schwiizer	BE
bin ìch voo vo trüenige uf uf de famili hoof ǜberglouffe	LU
me het sich begrüesst doo und umeghoket	BE
er hät ä miir	ZH
in dr regioon bliibe als therthoriaalmaa nìt	BS
u nä hei doo üser offiziir doo mit de	BE
cha öppe vilich im februaar si gsi	BE
s lokaal ghaa und d bresidänt vo dene veräin die bresidänte die si äu akzionääre gsii kwaasi oder d vättere vo deene	BS
s git chrieg die hends sind iizoge worde aso	LU
und im ussedienscht isch numen eine gsii e koleeg de büelmann	BE
bismer äbe i d alpiina si de bini drizejärig gsìì	BE
und das möösli das git s hüt no	ZH
no noch em chrieg	LU
won ìch ali briefe jez no haa	BS
u das si wauuisser gsìì d achtenachzger aso echli	BE
has seer seer schön ghaa mit de leerer mit de leererinne	BS
ja e ganz sìcher	BE
chö̀ne rekwiriere in baasel brifaat	BS
es ìsch eifach aarbeit gsìì mer het	BE
negatiiv beuurteilt woorde	BE
o mim nid viu verschtande hei dervoo	BE
das waiss ìch nììd	LU
deet bi waltshuet unen und ununterbroche mit em militèèrzüüg hin und hèèr gfaaren isch mit uuraalte soldaaten und miir händ ja gmäint en aagriff schtaat bevoor dèè wèèr dän im härpscht alefals	ZH
das läbe z füere	ZH
ùnd de hesch es maschìneli ghaa ùnd hesch sälber chönnen anke mache	LU
do isch s ned möglich das mer siige tuet he	BS
zäme gschlaafe zäme tuschet zäme gwäsche	ZH
das het mer natüürlech ùnd den sìnd seer vil d schauspiller jǜdischi schauschpiller	LU
mi händ dänn	ZH
und dän sind mini eltere	ZH
me het ghöört si wäärded wider kanoone produziirt	BE
emol uf e disch klopft zum zäiche das äär in dr frömdelegioon gsìì ìsch aber verloore wüsse sìì ganz verloore	BS
und underofizier jungi jungi lüütnäntli	LU
vòò au vor allem vò jùde verfolgige	LU
die het haase züchdet im gaarte	LU
z schtand cho ìsch ùnd die het mer de deete beschäfftiget	LU
absolwiirt han und di mir körperlich und psüüchisch waansinig guet taa	ZH
do han ich also eher kämpferisch de isch	BS
jaa lifa u vonroor ìsch glììchig gsì	BE
woo d ängländer ganz	BS
bis em moorgen em eis dienscht ghaa s isch amne samschtig am aabe gsii	BE
ich glaub proo chind öppe driissg franke	ZH
doo han ich doch e paar so wüssenssache mitgnoo	BS
fǜfzg jaar oder sächzg viirzg jaar	BE
und hät mini frau nach dielschtorf siiner ziit choo laa	ZH
wird vilech länge	BE
händ wie die sussmann won ich ewäänt hän	ZH
wäred dären abrüschtigskonferänz in gämf hät me jaa	ZH
aber bim mòòrgegrääue hèt me die us em hanngar gnoo wo mììr jeeden oobe	BS
schlìm ìsch ja auues o nìd gsìì me het ja zässe ghaa me het ja aus ghaa me het	BE
u de ds mueti het do gseit das das chö̀n ääs eifach nììd	BE
ùnd insofèèrn wèèred mìr aso inere	BS
wè mìr aso nach wäggis zooge wèère ane viirzig	BS
näi aso er isch dänn	ZH
jä är het scho als bueb	BS
dää het dä het gwǜsst dää goot iez in büürgebäärg hindere go ko go kontrolle mache	LU
die maschine sind gloffe und iich ha das glük ghaa	LU
und ich ha no di fröid ghaa	ZH
im füfedriisg	BE
das het ales zäme nüüt gnüzt	ZH
foor woo duomõ	ZH
e hend si sich miesse i de chuchi mer hend ja niene me het ja kai baad me het e kai tuschi niit ghaa	LU
de hend sis i denen alte schriiner ggä die hend tänkt isch en aafänger de het kai gält	LU
und èèr hät zwäihundertfüfzg franke verdient bi dem püürli das wäiss i ä na	ZH
also guet isch chuurz nach dère sach gsii	ZH
si vatter ìsch e z lùzäärn ufgwachse	LU
u nächer iivernoo und	BE
daa hämmer eso zältmarke ghaa	ZH
theeme ghaa	BS
wän de käiser	ZH
noch wienecht ane viirzgi	LU
simol au e jüdin us schernowiz wämmer frage	BS
ja was öppe esoo z mache git	BE
sibezäni isch er gsi ja	ZH
meer oder weniger	ZH
si sind absoluut nid beräit gsii	ZH
dä hät nüüt ggässe	ZH
isch induschtrii gsii	ZH
huusbeamtin gsii z altschtette	ZH
ùnd d ameerikaaner sìnd dòò fǜr mììch	LU
das isch übertribe gfrogt oder so he	BS
russischer abschtamig	ZH
ne hei mer glost und da han i das si zwoo persoone	BE
ùnd ìch chami nò guet erinnere dòò han ìch i de suuwa i der eerschte jòòr gschaffet deete	LU
das sind dii gebolte das isch daa	ZH
waffefabrigg hät mer ou chönne gaa	BE
anderi wo poli	BS
isch ja nachhèèr dän nüme	ZH
dur de gäneraalschträik isch er i d arbäiterkomissioon vo de lokomotiivfabrik	ZH
bärgfüerer gsii im bruef isch är primarleerer gsi he	BS
äu mit kanoone wäis nìd wie me däm säit	BS
die rüschterei alles oder mer het òfe äbe houz	LU
daa ìsch da aus ufgfaare di	BE
doo simiir no vo de sozialischische juged simir no degäge gsii	ZH
für waas waisi nüm uf jede fal e halbe monet	LU
das si eifach so	BE
und mììr sìì vo chind aa vo ganz chläis chind aa	BS
is sogenante schprüzehüüsli abgfüert woorde und iigschpärt woorde	ZH
die si zwangsaarbeiterine gsi und die	BE
jede is isch i sis land i d rekruuteschuel	ZH
ja und die sind mir hend änge kontakt mit öü mit de junge	LU
hetmer de befääl dureggää ich söl	LU
als in den heerkhö̀mmlichen armeen nìt	BS
etnie	BS
ich ha s im milidärdienscht	ZH
und wie mer vilicht	ZH
me hät äifacht vom chuchifäischter zum andere chuchifäischter	ZH
und dänn schtralsund und in schtetinerhaf	BS
i ha eifach nei echli wüu i äbe schportliche gmacht ha	BE
und vill gschnorrt oder soo	BS
oder mi vatter ìsch jò au gleerte telegrafischt gsii	LU
kampf bis zum letschte	ZH
jèè nie im läbe	BE
petroolfunzle s wasser hèmer mössen im hole im brunnen usse go hole	LU
füerer han ich nie gha im lääbe	BS
dä wääg wo si benuzt hei isch dert	BE
je mir händ vor alem es ìsch jo den glii emol de chrieg choo ùnd den hèt mer vor allem äu häärdöpfel aapflanzt	BS
am driissigschte sibte nünzehundertdrizää	ZH
nünzää im juni	BS
dää sig eifach nüm cho schaffe	BE
wo der her minger dehai gsì ìsch nìt hämmer emòl chönne	BS
