z weeni kent aus das mi da hät chönne es uurteil biude	BE
in dübedorff jawol	BS
hani aagfange mit woni sächzääni gsìì bi	BS
sind alli i d chäller ggange lùftschùzchäller	LU
und dää het ìsch das ìsch no gsìì	BS
ufträtte gha händ nìt	BS
äär hèt äu scho voor em ggrieg	BS
trier	BS
mer händ daamals natürch e raadio ghaa händ	BS
naaieri gleert	LU
de hei mer s aube fasch beröit das er wider abproche het	BE
nei das weiss i nüm usswändig aber	BE
dä het gsäit zu mir wüsse si jez mues ìch	BS
verhafted gsi e paar monet in schpanie oder so	BS
wen mobiilmachig isch aso am morged mues ich gaa ich bi der ainhait woo grad münd gaa	LU
es isch s blau hämp gsii aso wi wie d arbäiter das ghaa händ	ZH
und jaa aber süscht	ZH
ùnd ìsch ersezt woorde	LU
die het die het mer	LU
mer händ mit jude normal bezieige gha	BS
ja mir hei e raadio ghaa	BE
esoo	BE
au nööd näi na	ZH
nai nai das	BS
chriegsgfangene chönnen aanää	BE
nach e parne monet	BE
aber jez gäng das ou nid	BE
de do in basl gsi isch dää isch au abgschprunge vo dr khapede	BS
dä het e beiverlezig ghaa han em gseit er söu dä ou do loo	BE
i dem alte huus das ìsch	LU
uf schwiizer gebiet übere	BE
aso nachher woos fèrtig gsii isch	LU
nai er hèt nie hai chöne	BS
das ìsch esoo	LU
für mìì hütte no en ungläublichs erlääbnis	BS
und d chinder het uf uf d chinder hani	BS
und ich tüeg immer nur frö̀ö̀ge ich seig en frö̀ö̀gli	ZH
ùnd settigi wo wäg angscht oder sogaar gmaint hend	LU
biss bis mir zimlig	BS
beziig ghaa dur d graafik dur daas	BS
sächs franke föifesibezg	ZH
dasch e riisige gaarte gsii	BE
über weles teemaa	ZH
de hets de mengisch äbe derbie ghaa wie gseit womer	BE
da isch vierzig gsi bim fall bi berlin bi fall vo pariis	BS
jä si hetti vilicht scho khöne wenn si ned vom schtaalin missbrucht worde wäre	BS
ùnd de bin ìch grad i d schuel choo im ane nüünedrissgi	LU
eso hèèrt gsii isch	ZH
und en undefiniirbaare härdöpfelbrei	ZH
und zwaar isch nach churzer ziit	ZH
hei müesse mit der aarbeit z uusseze chuurzi ziit	BE
wän er au im dräk umegschleipft wird aber dää ìch hüt für mììch nòn es ideaal	LU
hundertachzg franke	BE
jo also ich bi natürli da isch wenn si frooge wo wo	BS
ǜǜber d schwèèri vo dène fèl	BS
das wenn öpper di dienschtbefääu söt i d finger überchoo	BE
bin ich mitglid gsi jä das isch mit däm	BS
truurig aber schöön	ZH
het äär al öppe wen er am òòbig am zwölfi haichoo ìsch	LU
aber i ha gwüsst wi das ìsch wen de vatter furt goot	BS
won är ììm daas het mǜse ablììfere	BS
isch päitsche gsii und soo han ich mini	ZH
fǜfzg	BE
sinds jò esoo voor em chrieg ìsch das khai brobleem gsìì d ussrais ùnd iirais	BS
dä isch es jaar jünger gsii als iich	ZH
für griechisch dasch en interessante ggsìì de hèt mee verzelt vo	LU
hämmir hie und daa ä so wie lieder ghaa	ZH
und den	BS
we mi vatter e zǜriziitig awègg überchoo het am baanhoofkiosk	LU
dò weer ìch mìì aifach	BS
mag mi erinnere das ìsch jez nìt das ìsch nach dr èress gsì dasch i dr unterofiziirsschuel gsì am mim zwanzigschte gebuurtstag	BS
und dän händs dän händs dän s hoochzig	ZH
s ìsch immer kholeggtiifschtraaffe s ìsch vilìcht aine gsìì	BS
me het nie nie genäu gwüsst	BS
alsoo mini gotte hät dänn no ä garte ghaa	ZH
är wüssi jez dehäim sig karfritig	BS
ab de mueter he	BE
ùnd ùnd im vatter hälffe ùnd fir die chind bi de verwante zaale	LU
gälled	BE
dasch im gränzwachtdienscht gsi	BE
glänkroimatisme sich	ZH
verschtekt er hät de ganz chrieg mitgmacht und a de i de lurettahööchi	ZH
flüchtlingsprobleem het s doo nid ggää	BE
das nìt in d khwèèri cho indäm ich	BS
ich wäiss nöd was ich gmacht hetti aber warschiinlich het ich	ZH
das isch also e chlaini zirggl form	BS
und der her schwiter het daas glii gmèrkt dr häuptmaa schwiter	BS
jaa das isch öppe	BE
da wäiss ich jez halt nöd ganz genäu	ZH
ä pholohemmli mit däm bin ich iigruggt in d rekruteschuel he	BS
und zu de rosa he	BS
u für d offizier wiu die e serwiette hei ghaa es zwänzgi	BE
und nachhär hèt me chönen en ufnaamebrüeffig mache	BS
aus weniger wichtig aagluegt woorde	BE
hends den nid immer nur immer nur gschpaaret und uif der siite und	LU
ez simer aso sächs schüeler gsii de hämer en äinzige ghaa	ZH
isch äifech verukt gsi	ZH
zwüschedine hät si no gwäsche bi lüüt	ZH
ùnd do het mi de tokter welen is bedli tue uf löikerbaad zùm saniere waarschinli	LU
uufggää jiz chön me de aafaa uufrüschte	BE
hindeburg do in si machtposizion richskanzler igsezt worden isch	BS
ǜberchoo wobii dä gschmak	LU
gnueg ùnd anke hesch au kene ghaa aber s mìlch ìsch nò	LU
siis riich vergröössere	ZH
im rame vo dr marggsischtische schtudäntegruppe	BS
normaalerwiis ganz is eggstreem	ZH
de de verlumpi miir	BE
die hend den nacher gsait ou wie scheen die hend do hier inne glèèrt schiifaare	LU
damit si s nid gsee vo tütsche häär	BE
sìnd also au nìd esoo	LU
was han i der der nedergang vo der schpanische revoluzion jä ich ha	BS
e e klään mer het mer hend zämeghaa	LU
esoo das i eigenlech immer bi im dienscht gsi	BE
äidüütig mit der muusig muusig het mir über alles ghulffe	BS
es hets nie ghäisse du gosch nìd zu däm oder zu däm chind oder zu fründinli oder so das hets aso nìd gèè	BS
diräggt in d ofiziirsschuel choo	BS
as as hilfssoldaat kwaasi	BS
ewägg choo	LU
und den häi die daas ales uusegnoo und d gescht si furtplììbe	BS
wo me do härzmittel draa	BS
duu	ZH
öiroopa gìt	BE
wo in tüütsch gsändet hend jò	LU
schon en andere drinne gsii	BE
de hends mer nò anderi gää de bluetdrùk ìsch ou z hööch	LU
und jezt wie täil ich das mine frau mit	ZH
vo denen eggippe si si ame ǜberechoo menngisch choo für es ggaffe oder ou menngisch am aabe	BE
und immer mee hei d lüüt aafa flueche	BE
nenei einnglech nììd	BE
u näär isch s wiiterggange	BE
sälber	ZH
und unger dene schtrüücher isch s fiischter gsii	BE
und i ha sälber gchochet	BE
bin ich unterem in däm sinn militärische drugg gsi	BS
da isch de name vo mine veschtorbene frau	ZH
ganz genau rächtlich wäiss i das isch emaal äin grund gsii	ZH
den mìr hend müsse vo de suuwa uus	LU
bewoorben um en imigreischenwiisum	BS
im schportspalascht bin i gsi	BS
ez schteled emau dir sit ìmene baanhoof gsìì	BE
äär dur e profässer	BS
und eine de hei mer zwee di hei ramseier gheisse	BE
om d mamen ume om mimi mueter ume das isch miis	ZH
eener es bizeli	ZH
hätti daas nid akzeptiirt	BE
chrankekasse zum biischpil d escherwiisschrankekasse	ZH
mit de famiilie mit der frou u	BE
er hät nöd vil verzelt vo dèm chrieg er hät nur immer gsäit s tö̀ö̀rf ggaar nie mee chrieg gèè	ZH
und de het er das züüg aagluegt ner het er gseit jaa	BE
aber im andere im originaau si s auso	BE
im novämber zwaiedrissg wär ich scho	BS
s gsìcht volle bläze ghaa	LU
ich ha das weniger affektiv ufgno die sache	BS
u üüs het niemer öppis gseit wo hùndertzwänzg	BE
gopfridschtùz wie jo wiä chunt ou daas nò use	LU
ùnd die vo riiga sìnd plobe	LU
und äär het sövǜu wie chli voorabaiter gschpilt und drii seen hend schriiner glèèrt und die sind den al no i de lèèr gsii	LU
und ha se mitgnoo uf e poschte und dört	BE
ìsch asoo	LU
mäiteli	BS
wil die jo häi dört mǜse uf irgend en aart	BS
es ìsch nüüt gredt woorde mitenander mir hei nie ììrgendwie	BE
wì mer mìt weenig gliich guet cha chòche	LU
daas won i näär do drin gschribe han i näär dert abgschribe	BE
si sind übrigens ä bi de geburt	ZH
und dänn hämmer i de	ZH
und und das ìsch het het aagfange und das ìsch e gwüssi ziit gaar nid lang gange	BS
doo scho ghöört vo konzentrazioonslaager	LU
nüünedrissig jä und den ìsch derno schoo	BS
und presidänt vo de proo juwentuute vo de schwiiz	ZH
und dän hät min vatter gsäit jèè das gläub ich nööd	ZH
und die rekruite die hend das ja ganz leschèèr sind die gsii die hend	LU
und der eutischt brueder isch gad i de leer gsii	BE
dass glingt nìt das eggsperimänt	BS
het mer di ganzi nattuur ggsee erwachen im früelig ùnd im summer ùnd im hèrpscht	LU
i fläschen ine	LU
im pruef ggsìì ainen ìsch wagner	LU
hät häts wäär dää schtìmrizechrampf glö glööst aber das het äär nattüürli nìd gwǜsst	LU
wo mìr in dr umgääbig bischpilswiis händ chöne hälffe dasch nìt ǜǜberal mööglìch gsì aber ich mag mi erinnere bì emòl ufeme boschte gsì	BS
sider si de die mit em furgõõ choo u näär hei se ne uufglade und hei ne när abeproocht	BE
ùnd das ìsch aso e schlächti zit gsii ùnd das hèt sich jez natürch uusgwììrggt	BS
daa zale es koscht so und so vil und die wo nöd chönd zale	ZH
oond hed do si seer egoischtische interessante läbenswääg het är gmacht gha sit zää joor	BS
ha müse	ZH
mit mit	BS
noorwèège	ZH
di voorschrifte hei immer wider echli ggänderet	BE
susch seer guet mol mer hènd aso	LU
unseri gschlächtsorgan hämer i sand gschtröit oder so	BS
die	ZH
das sind scho anderi gsii wo sìch daa nachegmacht hend	LU
und ich mag ich mag mich erinnere	ZH
und dee het der der fäldwaibel gsait si haiged en underofizier	LU
und d franzoose hein im die ggää	BE
drum isch ja ganz klaar gsii das mir	ZH
äbe si siged gflüchtet	BE
d pflääg	LU
si gsìì ou wo gschuutet hei mit üüs	BE
sibeze achze jäärig	LU
naagää vo de schwiizer behöörde	ZH
u de het mer die müesse schteuue	BE
und d d wächsulouftreeger	BE
irgendwie de vatter vilicht maler gsìì oder de anger schlosser gsìì u	BE
imene zouhuus gwoont	BE
mit de beschlaag a chopf tööt	LU
ich wais nid eppis defüür oder degäge	LU
si scho so boue woorde das me	BS
und gwanderet	BS
ja mir hend immer kontakt aso d famili mir hend troz allem	LU
und de het er amig gschpaart het sich gsait me het sich nie es möschtli	LU
gaar nüüt	BE
es teema gsii	BE
und ich ärinnere miich no	ZH
vo däm georg trotmann	ZH
i ha immer	BE
nie miteme zeeche in dr sowjetunion nai	BS
miir üüs i de schwiiz sicher gfüült	BE
si daas nid irer unifoorme gsii wo si	BE
d finlandiaa we imne gwǜssne sin oder	LU
laider hämmer khai bezijig me mitenander äär isch	BS
nìt nuur in miiner generazioon sondern äu jüngeri	BS
ich bin sozialisische juged aber	ZH
gsinigskundgäbig gsii ich wet iiträtte nid waar	ZH
ich mues sägen alsoo	ZH
aber si händ immer gschafft und wo min vatter arbetsloos gsii isch hät èr ä gschafft	ZH
s giit nüüt anders er mues fuurt ooder	BS
aso hüt wüürd me säge er isch en softi	ZH
chliini löön und de wenig aarbet	LU
aber ich wäiss das s für chrankekasse wotiert händ	ZH
die riiche liit gend ez den mit em gäld echlii echlii uise	LU
us	BE
dee wäret de ziit wo sii ais hani chenne im huis abgää	LU
nid händ wele iiwürke uf poole	ZH
jòò jawol	LU
u gäu do si de die	BE
mäinsch chan ich immer no schuel gää	ZH
gflǜchtet häi i d innerschwiiz	BS
isch er choo und dänn isch s i allne ziitige gschtande won ich	ZH
je ds einzige wo wo mir wo mir hei ghaa si	BE
das händ d poole verwäigeret	ZH
ùnd dä hitler wì dää disi länder überrent haig nöitraali	LU
u u bi viune bini tiptop	BE
ich ha der ich ha vil tue fir frendi liit gflikt	LU
süsch heig si nid einzeln döörfe goo	BE
dä daa wird ich soorge	ZH
vo dene päkli won i vo dehäimen überchoo han	ZH
s isch nach em chrieg soo gsii weme de nit grad güet zalt het het me de niit ubercho	LU
dasch öppis anders ggsìì wie de wili de wili isch echli tüütschfrüntlech ggsìì de gisò̃ò̃ dää het	LU
haut mit der petrooulampe no miesse goo	BE
aber nie schpontaan ùnd si hend au weenig glachet	LU
wie jom kipuur und rosch haschanaa	ZH
mir si ja meischtens im oberland gsìì im dienscht u	BE
magaziiner	LU
agluegt gha oder	BS
das hät überhäupt nöd	ZH
und das het natiirlech de risegrooss intressiirt	BE
am aafang dasch au esoo öppis oder wo erwäänenswert isch	ZH
we sii wie si unrueg sìì	BS
bin immer de de füerer rächts gsii	ZH
in zitnoot hèt me den	BS
wil die russische khämpfer sind jo waansinigi khämpfer gsì	BS
das mer öppis het chönne mache	LU
alli wäärde iigschrììbe in d armee	BS
und si si grad unger s grooss han i gsee peewee do uf em rügge	BE
daas ìsch daas jo	BE
verwantschaft vo vatterssiite	ZH
ja d maitschi sind scho wäret em chrieg ja choo aber	LU
di iskussioon gsii	ZH
het er aube gseit soo was isch loos loos schaffe	BE
also äifach für en anderi	ZH
dass das ìsch wì wì s biichtghaimnis gsii das sait mer aifacht nììd	LU
me hät äifach nöd dadrüber gredt es isch totaal verschwige woorde	ZH
han ìch e toorte vo dehai bechoo	BS
aus aus eggsportiirt het	BE
wie thol dass das sig weme mitmacht	BS
das wort dienschtverwaigerig han ich damals	BS
bis er bis mer do em eim wo pfarer gschtudiert het	BE
er isch schpö̀ö̀ter alkohooliker woorde	ZH
wäge dem hanis einnglech gschrìbe	BE
aktiiv nid nid in nid i die	ZH
jèè dasch	BE
jeedes jeedi ortschaft	BS
är haig mich doch gfraagt wär tuet derhaime luege hani gsait de soon isch	LU
und soo hämmer dänn d mieti	ZH
mh mh	BS
uissenuufe iises hiisli schtaat ez nimme uissenuufen e schtäge gsii und de hend sii de schlüssel ghaa	LU
das han i aber wider vo mim bekante ghöört vom röbi risler	ZH
nid angscht aber reschpekt ich mäine fü mich isch	ZH
sägemer emol für d armee ha chöne iiseze	BS
das me sich sälber i d hööchi cha lüpfe	BS
jo das han ich do das han ich döt scho gwüsst	BS
wen ainen aarbetsloos wììrd das er sèit ìch wot im prueff wiiterschaffe he	LU
wen d eltere das milchabonamò̃ò̃ glööst händ nìt	BS
wüss si mit filosofii han ich mi noni so schtark	BS
immer seer es guets verhäutnis heimer ghaa	BE
di zwoo daame doo si müed gsi nen e e schtueu	BE
jèè nai dòsch nìd vil verzelt woorde i wäiss nìd si häi ali angscht ghaa	BS
schpeziell wo mer schpööter nacher is redwii sind	ZH
die si scho rächt gsìì aber	BE
lill überegfaare mit em weloo	ZH
er hät sich i käinere wiis i de öffentlichkäit zur verfüegig gschtelt	ZH
deet wo die schtruub ziit gsii isch	LU
bürgerliche	ZH
zu sibzig achzig achtenachzg nünenachzg prozänt blüet und jezt worschinlig auno blüee tuet wider	BS
zu dä muäter ggsait gha d muäter hät mir das immr verzellt	LU
was hetted mi jude sole mache	ZH
amordodo) de är hed he schuss vo hinde bekho	BS
die ainte sìnd de hüt mus me säge tùmmerwiis wiiter nòch frankriich	LU
mit ììm zääme	BS
dr bootschafter hèt mööglìchkhait ghaa dò sich in schwiizerischi milithèèraaglegehaiten iizschalte	BS
dasch glii vo aafang aa ainglich gsìì	BS
bin ich abholt gsi in jedere form he	BS
ich hanen ja ich hanen ja äu ghöört am raadio	ZH
i gloube isch da drin wenn si s gseit hei	BE
da sind jo dänn au faggtä gsi	BS
aso in der turnhale zum bischpil in gälterchinde	BS
me het käi beziejig den ghaa mee zuu zu usser usser	BS
und mir sind uif das dachau gfaare jessesgot	LU
jo als zwanzigjörige jüngling	BS
seggsuel beleschtiget hät	ZH
hèt die kholeggtiifschuld hèt men aagnoo	BS
seer seer guet aber äär het derno müesse	BS
jede het eifacht jede abschnit het e nummere ghaa	BE
und deen mit füüf jaare sim mir nach schtans cho	LU
grooss afa probaganda damit gmacht si het e	BS
aber isch denn e wichtigä maa worde	BS
e paar monet oder e paar wuche do hend dörffe choo	LU
ìch bì irgendwie immer e chlii en kämpferische gaischt gsii	LU
und und hät jede jedi aarbet gmacht wo aagfalen isch	ZH
zueche si hei mi nid gsee und ha sen aaprüelet u aaghaute	BE
woo äigentlich hetti schpö̀ö̀ter möse devoo hetti möse gäuläiter wèèrde	ZH
pischte ìsch jò nìt lang gnueg gsìì für die schwääre maschììne	BS
ja mi het eifach so ds gfüüu ghaa	BE
da han i pressiirt am moorge bi s säuber go hole de wenn er gseit het	BE
das isch mitere seilbaan	BE
und hät en zääner überchoo	ZH
zimli lang voorbereitet druuf	BE
e majoor pfischter das het das ìsch dasch aber wäret em chrieg gsìì	BE
und das äär natüürli au käi schtell me gfunde hät und dänn hät möse	ZH
aber ich mues säge mi maa wen er het wider miesse iiruke er het nie nie nie isch er	LU
er ìsch gschtande natürlìch au	LU
mir sind ja zum glük verschoont plibe und wemmer òü echli ängi	LU
as nuun aso gwüssi zaaraadfrèèsmaschine	ZH
wo ganz bewusst aagschtelt isch um der ander kabutzmache	ZH
das isch aso en tüüfschlaag gsii win iich i mim ganze	ZH
in frankriich gsii als militäärataschee	BE
mir häte eifach gäärn eis rächti richtigi soudaate	BE
gäl wen nüüt ìsch loos gsìì niemer nüüt	BE
dä chönt ä maal leerer wäärde	ZH
für öis ìsch d eltere	LU
si si aube choo	BE
mir häi aber interessanti theeme ghaa scho	BS
han i se abgfüert und da isch s natiirlech richtung trasedinge	BE
mir hend jò öpfel ghaa im garte ùnd bììren ùnd soo	LU
wänn iich amel lise	ZH
damals isch ja äi kriise nach der andere gsii in dütschland	ZH
ich ha also khai glaube druss gmacht emol khä glaubä	BS
die seled uf d wach	ZH
in es anders hiisli dure und det het er zää jaar uf de maschine gschaffet oni haizig	LU
das si esoo chlii wie söli säge	BE
ìsch ruuch ùnd nüüt gsii	LU
wo me gmeint het jez chönd s de loosgoo u nächer	BE
wen si ghöört hend vo de di waisse roose	LU
der meischter gsii und zwee leerbuebe	BE
wen ich de ainisch urlòüb ha mues ich halt de go wiitersch mache s gaat en andere wo nid mues i s milidäär	LU
und das isch dä emiil kägi also dä	ZH
geit wenn öpper umeglüffen isch	BE
under em gäld ìsch ggsìì am oobe	LU
ùnd das häm miir nìt vertrait das hèt	BS
und näbe däm ìsch äär überal büürge gsìì	BS
dene hät me hälfer gsäit	ZH
het äär müese das die wiihandlig übernee	BS
büro gsìì aus armeebüro gsìì	BE
ja me hät das natülich au erfaare durch d prässe	ZH
säuber gmacht ha mit paarne usnaame	BE
und me mir häi	BS
d bewegig in dr schwiiz he	BS
nai de het mii maa no miesse d maischterprüffig mache mit vierzge	LU
aber näi da mag ich mich nöd ärinnere	ZH
mìtgsunge hend si nie das begriif ìch jò oder ruò̃ò̃ ùnd die schtet	LU
chönne es büechli choufe und de het di aui	BE
bis iez	LU
und vor alem die lieder mit uns ziit äin nöier gäist	ZH
ich wäärend em chrieg händs	BS
när bìni ǜbere u u das ìsch der grung gsìì	BE
zum biischpiu roucherwaarsache liin	BE
ùnd ais ìsch hüt nò z lùzäärn	LU
und mi sind i uurdorf gsii wi gsäit	ZH
jòjòò jòjòò mi schwöschter ìsch es jòòr elter gsii	LU
und so isch s gaas ggange u nächäär	BE
d ding verträtte	ZH
waarschiinlech unden ine deete nìd das ìsch jò deete dò	LU
er het	BE
do bin ich natürli scho nünzehundert drissig zwaiedrissg e geegner dervo gsi	BS
deet gsii sind i de roote falke	ZH
und zwaar wäg sinere schuelreform wäg sine komunaale wonigsboute sind ja berüemt gsii karl marggshoof und so wiiter	ZH
so isch die tendenz gsii	ZH
wes aube alaarm het ggää	BE
si isch ja scho driissgi gsii aso scho für die säb ziit isch das ebe scho gsii	ZH
nid chönne phaute und di si näär aus ussländer behandlet woorde	BE
aber si hend mer hend de òü schpeeter daa nach em chrieg hem mir	LU
aber ou was in dütschland geit	BE
militäärisch zum bischpil hööchschteend gsìì sii wo	BS
inegwandere	BS
vo der eerschte bis d sekundaarschuel	LU
und das het nattürlech im chrieg bim hittler	LU
dänn hät de leerer gfrööget wär cha ez dä betraag	ZH
eerschte klass aa im summer hei mer	BE
hööchschtens no die gfaar we si hätte wöuue abchǜǜrze fǜr	BE
han ich d famili immer chenne zämehaa	LU
aso as was gee het an	BS
ùnd mer hend vil au d nòòchrichte glòsst	LU
vo däne lüt do	BS
ja me sind gsii aber ich ha käi ärinnerige	ZH
nachdäm was passiert isch und èèr	ZH
oder mer het mer het	LU
isch en apsolutti kattaschtrooffe	ZH
weme sìch demit befasst het	BS
das äär daarf do duure goo und den isch en alarm gsìì	BS
mer sind öppen öisere drèi oder viir	LU
wäme ez den de patrulie marsch hät gmacht u umechoo wäär u	BE
läbesmittelgupòn überchoo	LU
u nächer oo chuurz druuf han i s oo	BE
de isch me haut wider zrügg und het ne schnäu zrüggtoo	BE
deheim sis auso ou we d frou erzeut	BE
und den hets doo eleganti lüt debii ghaa wüsse si die phoole sowisoo	BS
trinker jaa das hät s früener vil ggää	ZH
i ich ch jaa si hät das no uufbewaart voo	ZH
guet alles het mer nattüürlech ìscht	LU
bin aber nöd uufgnoo woorde	ZH
ìrgendwie ùnd den	LU
bin nachäär	ZH
und ali ofiziir vor alem ali flüügerofiziir sind tüütschfrüntlich iigschtelt	ZH
und da hei mer no referänze müessen aagää und da han i	BE
thaa das si nid so ghisse haiged susch haiged de naachbuire gmärkt as daa eppis tüegid schlachte	LU
im glaub i	BS
und daas us em aktivdienscht han i us em angere buech abgschribe	BE
in gwǜsse schtaate wìrd das rigeroos dùùrezooge nìt	BS
soldaate sii und müend di schwiizerisch di bürgelich	ZH
iivernaa wa mit miner schweschter was jèè was was mache si mit deene	BS
hets ja nìd ggää u mer hei ou nach em chrieg immer	BE
und döt womer emol	BS
wobi di di het jò nüt defüür chönne	LU
die ärztin he wo dreimol s exame hed möse mache hm	BS
glaub i am tag vom progom	BS
das isch allwäg en	ZH
hät er das nid gwüsst ich han im no mit guetem	ZH
üse kwartiir bezoge	BE
är isch ä ziitwiise gräist	ZH
es äug ghaa uf sini schpö̀ö̀teri fräu	ZH
und söttig wo underofiziir oder	BE
gseen i de gränze naa gad en schtacheldraatzoon	BE
ùnd deet sìnd de die läbesmittelcharte usggää worde	LU
ùnd au in dènemark	LU
und dänn hämmer es zimmer vermietet	ZH
han iich au deete im liechtatleetikklub züri	ZH
und mer hend e kaini hundert franke gält ghaa	LU
ani binder so hät mini mueter ledig ghäisse isch nünzehundertnüün uf amerika dure ggange	ZH
über wi heisst ez da de pass do bi nach aarou	BE
äbe de simer de det	BE
und miin vatter isch also dän gschtoorben im mäi	ZH
u nächär	BE
u näär bin i am wäägrand	BE
und de zuug in örlike rächtsum keert gmacht hät und wider zrugg	ZH
ùnd daas hèt sich aso khomplet gänderet	BS
hät teggstiilwaaregschäft gfüert	ZH
ùnd äbe die hend natüürli seer seer vǜu houz ghaa drum hends jò houzvergaaser ghaa	LU
ke muul ì bì glääge wìn es wìn e määusak im bet inne	LU
dänn hät mich äifach der unterofizier gsäit gang duu	ZH
me chön muurte nid erreiche	BE
pazifistisch erzoge woorden im achtedriissgi han ich d rekruuteschuel gmacht vorane	ZH
bin mer hät deete scho langwäle ghaa chuurzwälen und mittelwäle und bin e groosse fèèn gsii vo tschèsmusik han aso imer raadio luggsebuurg gloset	ZH
joo jez het me doch wider	BE
ich mues	ZH
de hemmer òü de tokter amschtaad het òü gredt	LU
imatrikuliirti schtudänt gsii ich betoone imatrikuliirt	ZH
de het mer eifach müesse eifach müess choo was het me süsch wöue mache	BE
isch isch dèè vatter halt ersch wider im achzäni	ZH
wie musi sääge wome probiirt het z verschteke wo aber bi öis im reschtorò̃ò̃	BS
me het würklìch nìd gwüsst was goot	BS
bi au no bi au	ZH
schimpfen in däm sin oder schloo das hets ggaar nìt gee	BS
aber zùm biischpüu es biischpüu des das muesi erzeuue	BE
de hets het mer männgisch a moorge so radaarschtraiffe gfùnde	LU
u jeze hei si es gschìchtli verzeut ö̀bs waar ìsch weissi nììd	BE
wens chrieg git und es git chrieg mir hend doch do sèèr kriisejaar ghaa	LU
jòò nòch em ässe ùnd am òòbig	LU
i dem haadee han ìch hènds mi nò nümme welle lò gòò	LU
isch e aapassende tendenz gsii sich aazpasse	ZH
ob er äifach nur wil sini koleege puure vo seebach	ZH
mit em chriegsänd daa ìsch na glii emau fertig	BE
äs isch ganz schlim gsii mir hend aso eerlich	LU
und doo isch er zum isch er het uf miim maa de vatter	LU
und den häm miir	BS
aha vorhäär bini de na im wäutsche gsìì es halbjaar in iwerdò̃ò̃	BE
in höngg bi minere gotte	ZH
hät me sich umegschlage	ZH
òòrganisazioone nìt soo intensiif mitgmacht nìt	BS
dass im grund gnoo d ängländer und d franzoose	ZH
u die hei gseit u gält heigs ou z wenig	BE
ich bi döt nie ine schlegerei verwigglet gsi	BS
m fründ vo im	ZH
nach em eerschte wäutchrieg ja	BE
d züriziitig läse	ZH
und bin natüürli wiitgééend uf unverschtändniss gschtoosse hä	ZH
ìsch guet	BE
laager und uusflüüg	ZH
isch ais ai platten um di ander gloffe und da	LU
ìsch vilicht äifach wichtig gsìì das me het chöne hälffe	BS
das unbedingt mus verbesseret wäärde und vor alem das mer	ZH
mir si di eerschte gsi wo hei	BE
und hät sich als juud uusggää	ZH
di alte lüüt di eltere lüüt	ZH
jaa s geit na soo	BE
jèss wi nèu	BE
es hät es zipazool gèè	ZH
das mer die nìd alli oder d mariluiis	LU
mer hend alli mǜsse schtòò di ainte hend blìndi munizioon ghaa disi hend gschòsse	LU
pfaarer würd das isch natüli en aaliige gsii	BS
u de het mer hüener ghaa	BE
vom eerschte wältchrieg und	ZH
asoo mir händ en schreebergarte ghaa	ZH
füfzä persoone	BE
esoo das es hättet mir nid esoo mituberchoo	LU
sii isch si sind si isch i sini wonig züglet das isch	ZH
mer si mer si einnglech ǜberau z ins ìsch gsìì	BE
ich wett ez sagen achtedrissg oder so he	BS
u nä han i äbe di patrulije begägnet vo üüs	BE
s me münd die mi münd die pärioode unterschäide	ZH
und das he het däm aaghaftet het er sich immer wele wichtig mache und het den m	BS
nume het s gheisse ja er sig juud	BE
nach semeschterbegin biischpilswiis im hèrpscht	BS
isch zwòòr ned immer ìsch ez würklich ned mìì	LU
heimer de vo de weltsche truppe womer de hei ghaa de hets de	BE
und aus abgschproche ungernang	BE
würdi saage ùnd	BS
de het me zwee franke ghaa am taag het me	LU
ich ich gsee mich hüt ich gsee mich ich gsee mich hüt naa	ZH
in der inere kantonaale	BS
aini ìsch glaub vo ruò̃ò̃ gsii	LU
joo do het me eigendlech do isch	BE
ineggange guuten muutes	ZH
di tüütsche hend jò immer ggsait	LU
händ si gjagt wie me wi en hund hase jage tuet	ZH
offiziir laager gfüert heid	BE
es hät e jugedinternazionaalen au ggää	ZH
das het mir e ungghüüren iidruk gmacht hütte no	BS
das ìsch ggsìì	LU
aber wen ììch nìd d muusig ghaa hät mit däm allem andere	BS
