zeersch isch e korporaau bin is gsii	BE
hin ùnd wider het mer chöne briged chauffe	LU
s ìsch scho vilìcht gmunklet woorde aber	BE
aber i ha gueti zügnis ghaa	BE
nai aber aso dää hitler das ìsch das ìsch für mììch	LU
aber waas i dene wägen ìsch gsìì öb da mönsche si gsìì oder waffen oder waas	BE
aber nìd milidäärisch sondern zum hälffe	LU
mir häi immer raadio glost wi mir häi ales ghört jò	BS
joo do si scho vil koleege deert gsii	BE
und das ìsch en induschtrii het aagfange ghaa döörte und do sìì	BS
siibenedriissg häi mir säggsedriissg häi miir ghüüroote	BS
den di tüütsche sìnd jò äu mìt mässerschmit hundertnüün gfloge nìt	BS
s s irgend es kompaniibüro aalüüte waiss nìd was für ais	LU
jez i d chegelischuel gäängt	ZH
jä wäggs bi bi mer heds khä wäggsl gä	BS
ja ja also zum bischpiil hämmer s mööslilied ghaa	ZH
mìr händ mit achze öis miese schtelle wì me dem gsait hèt	BS
wos do so wiit ggsìì ìsch de het me nüüt me wele wüsse vo houptma	LU
das hèt äär aifach bruucht als usgliich	BS
jä das isch	BS
dä isch hät gsäit ich bin kapedee	ZH
gschuemacheret u süsch allergattig daa umenand	BE
und ich han aso	ZH
cha hät e kène gwǜsst wo ǜber e generaal gisò̃ò̃ öppis	LU
italjèènische khapitalischte sag ìch deene jez	BS
für üüs ke roue gschpiut	BE
das wird	ZH
näi näi da han ich e käi ärinnerige	ZH
und sim und sin könig zum käiser vo abessiinie mache	ZH
d eutere scho nììd die si komplet	BE
i bi so kwaasi derzuechoo	BE
sondern den ìsch dr haim haimische hèèrd	BS
ich mues säge deet händ dänn ebe die emigrante gad dä tütschi emigrant	ZH
zerschtöörte öiropaa mit däm chinderwage gflüchtet	BE
tütsche schǜzegräben inne ghoket segid	LU
wie wemmer jez nöierdings sait mer jez	BS
das hed mi hoch interessiert	BS
u nä isch d gränze gschpert woorde s het niemer me inedöörfe	BE
und doo het mìì	BS
wääge vo de gränze au si zämechoo	BE
jo sich ufglöst	BS
daas undernee und	BS
mir de mit mit iisem schwiizer òüto dette gschtande sind	LU
öpis biete esoo uf die art und das ìsch unngläublich gschèzt worde	BS
er isch alerdings en ganz en groosse könner gsii aso retoorisch seer begabt gsii	ZH
die angscht ìsch scho doo gsìì es chönti vo irgendnöime häär uf öis zue	BS
dä het en angscht ghaa	BS
jòjòò jòjò klaar klaar klaar	LU
mit em poschtòüto doo oder wass si dùe gha hend esone sone buss eppis	LU
vilìcht nìd welle oder	LU
in öschteriich ìsch er jo scho gsìì	BS
si auso dört besser usgrüschtet gsii	BE
das ìsch jò im drüüedriissgi ìsch dää choo	LU
wobii das äu en eggstrapolazioon gsìì ìsch nìt	BS
het mer klasse zämeglait	LU
das ìsch	BE
d doorfbuebe z nideruurdorf	ZH
do het me möse grad am aafang derbii sii wiee de	BS
ab nünzehundert im sumer nünzehundertzwooevierzg	ZH
u me nächäär di biuder gsee het da het me gsee das daa	BE
im februaar viirzg bin i ja zeersch en monet lang i undersuechigshaft gsii	ZH
i pass ine	BE
und näär si mer	BE
uufghänkt a de füess	LU
si händ aso nìt dö̀rffe mit der peedeeèm oder haajòtuniform	BS
sägemer emol esoo	BS
e riise schlappe für di ganzi internazionali arbaiterbewegig oder so	BS
wil me dö̀ö̀rt hèt me daas glost und dèn hèt me die	BS
zu bikanti wo si häi aso	BS
das het oder	LU
de het mer nächher aber de ìm dienscht het sölig ghaa wo nie hei si rächt	BE
der eint het gheisse	BE
leeni nöijeschwander sopraan	BS
ou schpö̀ö̀ter hanis de mit em dedekter hani si nie ǜberchoo	LU
wichtig gsii isch d sowjietunioon isch	ZH
vo dem korporaal	ZH
joo das isch afach vorfalle	BS
s hät ä vil arbetsloosi leerer ghaa i däre ziit	ZH
vo dene wo ghüraate si	BE
uf är het gseit är wöu die sofort	BE
guet es ìsch jò intressant es ìsch chunt ìsch jò i de prìcht usechoo das hani im raadio ghöört dòò	LU
ìsch isch guet ggsìì ìsch guet ggsìì s het hööchschtens	LU
die hei ǜberhoupt nüüt dran ghaa u hei gschosse	BE
ggää het si nüüt die het nùr mit üüs	LU
ich ha nachär	ZH
es es ìsch o nìd gfluechet woorde u nüüt eigentlech he s het	BE
schuuflen ùnd pikel ùnd do	LU
mit so ìch ha doo no schöö iinaame ghaa gält gha	LU
mit	ZH
nai mi vatter het au vììl nachtdienscht ghaa	LU
mer het aifacht	LU
scho sini erläbnis ghaa hät ich wäiss es nööd	ZH
nai also ich bi erscht	BS
für e bluetdrùk das wìrkt	LU
die froog	BS
wo männgisch für e bueb gsìì si nìd für es mäitli fr	BS
sii hät chöne us nüüt hät si öppis chöne mache	ZH
hm jò ìch bì vom	LU
das chenne zrugg zaale	LU
we me driiglängt het ìs ìs wasser ìsch es ganz koomisch woorden uf de händ	LU
seer bald	BS
auso primaarschueuusbiudig	BE
zää jaar nach de	ZH
aber daas het für üüs kä bedüütig ghaa	BE
dasch u we irgend ö̀ppis wäär gsìì wäär wärmer zum houptmaa ggange hätis gseit aber das ìsch	BE
das ìsch ganz aafangs de dri zwöiedriissgi äinedrissg zwöiedriissgi ggsìì	LU
vor alem d aarbäiterschaft di lingge d sozi	ZH
aber ou immer ir unifoorm aber ooni waffe	BE
schööni zit ggsìì e schööni zit	LU
aiselkhind natüürli vonere mueter hegt und gepflegt oder soo	BS
aber mer het gwǜsst es gòòt	LU
er hèt uns aifacht probiirt z zaige wì thol das sii s händ als dòitsche juugend	BS
u nächäär ha	BE
hèt nìt durch abwèèsehait glänzt	BS
won iich aagschtelt woorde bi bi de sò̃ò̃do bin ich dur e daame aagschtelt woorde	BS
iich bin en äinzelgènger gsii ich bin seer gäärn eläige für miich gsìì	ZH
das me ganz vergässe het	BE
das hèt den uns äu nò zuesäzlìchi naarigsmittel gää den die buure händ uns den natürch äu öpfel gschänggt	BS
als zelt gsii ufgschribe wivil schtund und	LU
widerum vor der undersuechigsrichter	ZH
de generaal gisò̃ò̃ dää schǜzt üüs	LU
mit het s gfüüu ghaa	BE
es gääb chrieg ùnd	LU
jaa und na bin ich won er i d schuel isch uf luzäärn het er gsait zu mir du chasch òü mitchoo	LU
aber mi het nie gwüsst	BE
wil dis hät men anders sö̀le mache u daas hät men anders sö̀le mache	BE
jò dasch e guete maa ggsìì	LU
ùnd mit sine brofezeijige in main khampf hèt chöne zaige	BS
gsii das hät glaub undermoos ghäisse	ZH
läbesmitel für ei taag chönne mitnä	BE
und isch egiptisch und dasch de eeretittel gsii vom josef	ZH
s s ander ìsch dr schtaatsanwalt tokter hueber gsìì die sìì zu ììm phersöönlìch häim choo	BS
bekants theaater	BS
ùnd im nofèmber ìsch si gschtoorben anere lùngenenzündig	LU
wie säit me	BS
praktisch	LU
mee in voordergrund drätten ìsch nìt	BS
i de faamiilie scho aber nìd aber nìd under de gèscht	BS
wi ìsch ez das het äär scho het äär scho mit ììm	BS
briefe gschribe aber soo mit behörde	ZH
ais vo riiga	LU
und die drööt wo loose si gsi si no deert gsi	BE
häi si mǜsen im kantonemänt sìì	BS
ìch guet ìch ha a wèle de hitler go verschiesse aber das ìsch en en find gsii	LU
er ìsch alerdings	LU
isch die matur äiedlich vor sich ggange	ZH
a dene a die maschinen anechoo zum hälffe	LU
oder au am telegraaf dò hesch natüürli mängs ghöört das ìsch dasch aifach ghaimnis	LU
iiseze emaal für mis rächt und zwäitens das me i de schwiiz	ZH
zäme ggässe me wischich uf d närve ggange mit de ziit tes	ZH
de pass nìd ghaa dä hetere aus gnoo	BE
sibe chind gsii de vatter isch drèèer gsii i de	ZH
ärkhenntnis vom faschismus oder so	BS
gschwecht gsii natüürli	LU
ùnd e befääl ìsch e befääl ggsìì ùnd dä het müse schtrikte uusgfüert wäärden ùnd wen dä nìd usgfüert worden ìsch ìsch er verschosse woorde	LU
mitere flache schufle flach schufle	BE
deert di wäärde nume nid iipoue	BE
dòò hät ìch han ìch s gfül ghaa das dö̀rf mer nò	LU
die ìsch chlooschterfrau gsii in belgie	LU
mag mi nò guet erinnere mer händ	BS
uurlouber wette	BE
miir ìsch	BS
das ìsch aso scho andersch woorde nachhäär nìt	BS
a bii	BE
i de äärdchnächt ghaa	BE
dorum au	BS
und die isch e frä kööder isch das gsii und	ZH
a dem baanübergang gschtange	BE
di andere net aber ich ha halt das gmacht h	BS
jaa das isch	BE
under dèm tood vo mim vatter und	ZH
tünkt mi wi i weiss nìd waas i waasi na aus hät sölle verzelle aber es chuntmer jez grad nìd i sin	BE
und deert han i o ke ziitig ghaa ussert em	BE
höggschtens imene mondnacht nìd hèt me sii natürch scho gsee ǜǜberfliege nìt	BS
jaa jaa	LU
eerschtens die lüt wo saage	BS
zimli nervöös gsi mi het ds gfüüu ghaa ez	BE
ìsch ìsch i der simer ufnaam	BE
und de zwäiti grund isch gsii	ZH
mir hei radio glost	BE
wo dèn die iimèèrsch gsì sind	BS
zùm die nöötigen ofiziir nò chöne z rekrutiere	BS
ja i hanech das esoo im verbigang gseit dasch vìlìcht gad esoo	BE
won i i dienscht bi gsi han i s vernoo äbe o vo vo de soudaate	BE
bi de bi den elteren überhäupt e gaar e käi underwiisig ghaa han	ZH
grad fascht e wuche nochär jä	BS
wo nìt natuurwisseschaftlere gsii isch	BS
aso handwäärgger ghaa hèt	BS
den au verschòsse woorde	LU
ja hunderprozäntig dem hämmir natüürlich isch ja soo gsii aso	ZH
nei gchoufft	BE
s gfüül ghaa me mues gaar nümmen esoo	BS
ùnd mer sind jez rund zwanzig joor ghüroote	BS
luege isch no naachberabschnit bewacht oder niid	BE
dozed vo de dienschtkameraade	ZH
u de die vom flùùgplaz die si üüs	BE
ich ha müese luege und hälffe und defüür häi mììr	BS
uswiispapiir kontroliirt	BE
ruig ja	BE
wäg in faschismus isch jo denn seer	BS
über d gränze verirt hei	BE
kantonaale schpitaal woo wo äifacht überuus cho sii und so het äi möse den ander nüme grüesse ìsch aso ganz enzezlig gsìì	BS
dää isch denn khippt worde a de brüning isch scho lang vorhär khippt worde	BS
zää theaterschtügg oder gabare sache	BS
jòò jòò	LU
s hed vill bättler gha i de schtrosse	BS
sii händ ja äu chöne	ZH
ìsch nùùr öppe sììbe khilomeeter ùnd nìt zää khilomeeter	BS
und dänn a de wienacht nünzehundertnüünedriissg	ZH
und dùe	LU
und das ìsch schpööter witer gange und är ìsch derno	BS
was äigentlech ìsch dòò ìch chön han aifach koomische schmèèrze wen ìch	LU
ùnd enoormi verluscht ghaa händ nìt das ìsch jò s eerschte landigseggsperimänt gsì nìt	BS
dä het es	BE
dä ìsch esoo ne liebe aute maa gsìì de de	BE
i däre militäärischen underredig gsäit luged sii härr hauptme ich bin soon vomen aarbäiter	ZH
do hie si s zwee bänd hä	BE
oder fǜfzääte je guet i chönt na nacheluege	BE
joo vo däm het mer ghöört jaa	BE
die häi jo enand alli enander khent und di si ali befründet gsìì	BS
de hèt me nìt unterschììde du bìsch jez der ainzig wo das aingglìch gmacht hèt	BS
die määrggli händ si phalte nìt aber de räscht	BS
illegals material für tütschland beschtimmtes	BS
natürli e fröid ghaa dass dr eltschti soon au	BS
ùnd au was inechoo ìsch mer het nüüt gsee	LU
autoritääri erziijig wi mììr si no gha hend aso	LU
ha bi mir	BS
das het emol zu miner jùùgend ghöört den het derzue n ghöört	BS
dene ja de soo chlii	BE
zwöi franke gchoscht heh	BE
da nenei da chunt nìd i fraag i mache das ùf mi verantwoortig	BE
über juude isch bi iis nie gredt woorde	BE
oder di ganzi gruppe nìt wen iirgend so öppis passiirt ìsch	BS
min vatter näi min vatter isch en wiirtesoon gsii min vatter dèè hät achzehundertachzg	ZH
het äär	BS
es isch träit gsii isch es vo de soziaaldemokraatische partei	ZH
jaa di di si us friburg choo aui	BE
isch d einheit plözlech entlasse woorde het gheisse fürne liengeri zit	BE
in rùssland gfalle	LU
me het würklich mit de jùùde gaar gar gar käini sache ghaa	BS
falschìrmjèèger abgesezt nìt	BS
und das isch nume abwächsligswiis bewacht woorde	BE
mer isch kwaasi schtolz gsii juud z sii me hät käi anderi briraa ghaa	ZH
aber achtigschtelig nää wen er gschtangen ìsch he	BE
jessesgot simmer mit dem uif das münche gfaare	LU
het mer näär de raphort gschribe deheime	BE
ha gwüsst inere	ZH
und die hiessige lüüt	ZH
braaf isch wider häi hät ghulfe puure	ZH
aber me hèt gsait es hèt gaar khai wäärt me drifts jo doch nìt wil aifach	BS
ùnd aine ìsch glaub e bueb gsii so wiit ìch mìch erinnere	LU
de söu sich die go söu die go verteidige wo	BE
truppe bi öis ǜǜberal äu in der chuchi ghaa	BS
soo faltsch gsii wie die wo gmäint händ di schtèrchschti armee seg di französisch armee han iich phersöönlich nie ggläubt	ZH
ùnd die behäubte nun sind drissigtuusig lüt abgwììse worde s git doo anderi schtuudie vo franzöösische hischtoorigger	BS
amärikaa isch no so im hindergrund hät me nid gwüsst was die wänd	ZH
wel ich gsee es git ja nu chrieg wäns armee git also bitte	ZH
e e dreischpiz gmacht und dä het dää aagläit	BS
üse leerer doo de fridli dä het ou hüüfig	BE
ìsch aso e gwǜssi wuet ufchoo ir verdamte chaibe hän nur für öich gluegt	BS
grad im hèrpscht hemmer sii sogaar no müse go bewache i bi ou no wach	LU
gaschtschube z buze z wüsche un i bi ö̀ppen am haubi nüüni abechoo	BE
die gnosseschaft zum gfäl	LU
uf em see isch pro härrlich gsi	ZH
dää het en òfeschlùpf ghaa a chachelòfen i d schtùben ie	LU
es wärdi üüs de doch i alne de besser goo ùnd soo ùnd	LU
sensilibiirt gsii uf so sache	LU
esoo han ìch de iidruk ghaa	LU
und het daas gägesiitig abgwoge	BE
de hesch mösse s schuelzimmer taile	LU
de wääg obenaabe und geg wo s de geg d häuptschtrooss ììnechoo ìsch vom buurehoof ewägg	BS
und da hei mer e nachtüebig ghaa ire nacht	BE
öppe nünzenünedriisg also	ZH
und händ gsee wi hüüben und drüüben befeschtigt wììrd	BS
mit föif jaar uf rieden ufe hät me daa müese	ZH
und es isch öppe afe haubi eis gsii	BE
aso seer seer voorsichtig	BS
das seit mer ja hǜt das wìrd das he het mer ja gnue chönne läse vo dem ganze züg	BE
sämpach isch	LU
i dere so füfedriissg so sächsedriissg	BE
aber meischtens settigi wo sich als irrtümlich	BE
mir e sind froo as mer iises läbe no chenned rette	LU
e naachberi	ZH
in do hei si doo uf d gmeind	BE
wäme daa e rootemunder wäme das ghöört was da aus ggangen ìsch	BE
ìch mö̀cht daas ou nò abschliessend sääge	LU
me het gfrògt s wòrùm s ìsch vor allem s wòrùm gsii	LU
es groosses fluugbetting gsii gloub uf em bäupmoos usse	BE
wens hoochbetriib bin ich inen eppe go gleser schpiele	LU
wo so martiaalisch hüt tööned	ZH
nä ha ne gseit	BE
si si häi dö̀rffe go näi nìd emol z oobe nüme näi	BS
wìchtig isch deet äfech gsii plö̀zlìch hets ghaisse ez mus mer en eggstraschtüür zaale	LU
näi aso e zitlang ìsch är soldaat gsìì win en andere äu	BS
ä glatte worschich denn au	BS
deete si nomol d froog schtelle	BS
die häi die häi äifacht si seer güetig gsìì	BS
wi hät er ghäisse zünschtiie jugendbund	ZH
sind hald bürgerlig konserwatiif	BS
heh muusig mache mììr mi brüeder und ììch	BS
ich gläub er dr vatter hèt nò fuffzig brozänt vo sim loon bechoo nìt	BS
z nacht häm mìr nùùr höörmäldige chöne mache mìr händ si jo ä nìt gsee	BS
aber bìì vier chind	LU
de generaal gisò̃ò̃	LU
seg i d fröndelegioon es ìsch auso scho	BE
das han ich s nie vegässe das han ich seer seer gschezt	ZH
alsoo da sind den	BS
ha gärn für miich gschpilt	ZH
aso fäärnsee hets jò nonig gää doozmòl	LU
aktiifdienscht jee si öppe gsìì	BE
fabriziirt hät oder	ZH
etter dä ìsch im	LU
i de schportschuel baag in chilchbäärg äne müesen ame samschtig namitaag	ZH
aber suscht ìsch dò nìt gmuult woorde	BS
ùnd ais vo phoole	LU
und mi sötted e nois zält haa	ZH
di munizioon wo de püürli	ZH
und de het s glii aafoo gluntsche daa	BE
oder sììch vomene vomene schpìnner	LU
isch aso bis am elfi taag gsii im sumer	ZH
unsere isch gschichtsleerer ggsi und glaub i ned ämol e tumme	BS
immer ai marschplatten a der andere und mir hend	LU
ùnd ais e voorort vo pariis	LU
ha mi döt obe gmäudet	BE
dää häis	BS
aber mir hend immer arbet ghaa	LU
nonplusultra gsii	ZH
hät daas chöne	ZH
mi het scho chli verfougt was doo geit	BE
umelungeret oder ez schiked mer en deet hère	ZH
u nächer bire tante z bäärn	BE
liichetaili gsee aso schlim	LU
äänen a de gränze in gränzach	BS
voorhèèr ìsch alles seer in reegle	BS
dass mer äigentlich der iidruk ghaa händ di gröössere find sind no	ZH
ja ebe	ZH
tüegi lieber zäichne	BS
bi näär bi de schwöschter go schaffe	BE
iir setted öi iibürgere	ZH
nai ǜber d seebrugg	LU
ich ha nid welle in dr militärreschi	BS
je si händ drùf hììgwììsen ùf	BS
ùnd öb das gnǜzt hät	LU
und do isch men ine	BE
wo wirklìch ùm gäld veròòte hend	LU
widerschtand	BE
gäled si dä	ZH
mini grosmueter het de ììri schòggimäärkli nie pruucht	LU
ùnd äi chalt winter hemmer deet erläbt im chlooschter simmer iikwariert ggsìì ùnd dä	LU
bekanti ggää i öiserer umgäbig	ZH
und ha dänn das ä mit em rächtsaawalt han i das beschproche	ZH
also	LU
ìsch es sone nääbe sone näbebìì	BS
sodas ich näbezue ha chöne	ZH
hend jungi ghaa rekrutteschüeler	LU
den der soogenanti trozdäm er no dienscht dòò het äär ìsch uf d wach ggange	BS
uf al fäl heiged dän	ZH
ùnd das het de männgisch sogaar fääde zòge	LU
di rächt siite jò het	LU
jaja s het einzelni ggää ebe ja die fröntler da	BE
näär hei mer gseit ja iz mües er daas näher erklääre	BE
isch en unterwärfig gsi	BS
chuum chöne hälffe	ZH
was bäärn genääm isch gsii	BE
letscht ougschte	LU
als e fröideschtimig will	BS
und dert imene purehuus hei mer nächer im i de schüne	BE
in in däm huus	BS
är hed ghürotet vatter isch gschtoorbe	BS
mit der baan nach gfaare und deert hei mer e schtung müesse waarte	BE
dass das schwachsinn isch he	BS
die angscht das het me gschpǜǜrt das het me gwüsst	BS
nääie für lüüt flike und und buze	ZH
dänn han ich nüüt me z vertäidige ich ha gaar nüüt z vertäidige	ZH
ja da und uf dem umwääg oder ich säge schliichwääg	ZH
wo hät söuue i dr grooss kampf gaa nächher	BE
wo me wider vor di fraag isch gschteut woorde	BE
gschwänkt und händ gsäit näi au miir vo de sozialischische juged	ZH
komunistischi iiflüss gsii und mir sind ganz nach	ZH
nächer nümme das heisst einisch isch noo	BE
dasch tailwiis e seer en aaschträngendi sach gsìì wil es ìsch e vierezwanzigschtundebetriib gsìì wol in drei schichte	BS
den ìsch die besammlung hèt nìd gglappt nìt	BS
hämmer hät äär raadio gloset und isch	ZH
die händ den iri iischtelig	BS
di ganzi mentalitäät e so chli	BE
das ìsch aini glaub ìch vo den eerschte ziitige gsii wo seer vǜu	LU
mit däm het mer gheizt und	BE
und dört bin i gsii	BE
het	LU
wo sich nach miner mäinig	ZH
aber dem het me nìd esoo schtarch beachtig gschenkt	BE
jo wi ìsch dää gsìì	BS
da han i sowiit s ggangen isch	BE
dass gad frankriich und ängland	ZH
seer wèrtvol hät chöne underschtüze	ZH
ìsch ìsch das gsì amene geburtstag vom èltere soon jä	BS
und und vilich drüü chind	ZH
do han ich no khä wäg gse für d schwiz do bin ich also zwanzig jöörig gsi he	BS
ùnd den ìsch er natüürlech für di ander dò für di füfti kolonnen oder wie das ghaisse het	LU
mi maa het mǜsen iiruke jä	BS
das hät mich natüürli präägt mi händ höggschtens am suntig echli anke gsee	ZH
ùnd wens vol gsii ìsch sìnd si verschlage woorde	LU
joo di chönt säge diinstmäädchen hä	BE
und s hät äifach soozsäge i jedere ziit	ZH
mir isch immer pumere gseit	BE
im seggseviirzgi uf d wält choo	ZH
nä näi en	ZH
dasch e tüütsche leerer ggsìì	LU
hämmer öis sälber verdient min brüeder und iich	ZH
ahaa	BS
heh jaa am chriegsändi fasch eso füfeviierzg he	BE
liechter lösche e	BE
woo hütte e relatiif schlächts ggwartiir woorden ìsch dasch hinter em baanhoof	BS
läider chrank woorde	ZH
jaa formell	ZH
und dän simmer nach wipkinge züglet	ZH
eigentlech nume grüemt woorde gägenǜber hǜt	BE
im schwiizer militèèr	BS
u die si iigrükt u	BE
ich wäiss nu no das èèr amig	ZH
heigsne groue das nìd na mee paar mee bömbeli heigi abeglaa	BE
nai das ìsch über e chopfhöörer choo	LU
är isch en leerer gsii und zueglich no häilpädagoog	ZH
niit	LU
sondern gröössewaan	LU
säggs joor	BS
win e waar gsìì	BE
i hane das vilich sogar scho atöönt gha i bi eher bi der esaapee ggsi ned bi der khaapeedee	BS
de si do die vo dübedorff choo	BE
reschpekt ghaa vo de kameraade händ reschpekt ghaa von ene	ZH
die sin nid akzäptiert woorde di hät me nid ärnscht gnoo	ZH
wo abverdienet hend sind maischtens daa gsi i i dère kasärne	LU
und de hem mir de es isch gsii wie faadeschlaag	LU
u das schìff ìsch poue woorde fǜr houptsächlech fǜr die usländerching	BE
brüeder uf d wält choo	ZH
s isch jez gläub grad im	ZH
wäälschi wie tüütschwiizer wo nie so waansinig guet tessiiner und tüütschwiizer und püntner und	ZH
aauso nünzehundert	BE
prichtet woorde vo dramaatische	BE
und das isch natüürli e demüetigung gsii	ZH
chöider nech daas voorschteuue halt daarf nììd	BE
es git chrieg	ZH
wänn si veschtönd was i mäine tuen	ZH
schtolle cho	LU
i de regruuteschùu äbe dasch jez o e sach gsìì wider vo dem wie mer ufgwachsen ìsch he	BE
die ìsch schlìm ggsii die ìsch aso ganz schlìm ggsìì ìch cha mi nò guet erinnere	LU
dert tüe se kompanii besamle	BE
wänn si s ghaa hät hät si s mir nid märke laa	ZH
und dò het äär dört wen äär dört aane het welle goo go zäichnen über d schtrooss	BS
aus was wältsch sigi das sig also vom vom tüüfu dur daa hani natüürlech durch das es het mìr irgendwie son e	BE
dänn so wi di andere ggange sind	ZH
wèèr das de fal gsii isch ja dän äu wider nüüt druus woorde	ZH
de schok isch eerscht choo nacher won ich gmärkt han	ZH
das isch	BS
daameschniideri	LU
in döörflinge	BE
nünzähundertzwaiedrissg also do bin i us berliin zrugg kho	BS
äu	BS
isch a na wärend em chrieg gsii hemmer no die zwai maitli ibercho ja	LU
das würdi aso nìt saage das me daas ghaa hèt	BS
e wùutechi o nìd rächt	BE
ùnd wie gsait säli ziit	BS
da isch e sog vo der freihait	BS
juurapäss die sind verschtopft gsi wil äu milidèèr natürlech	BS
s isch me nid gliich gsii	ZH
u de heimer no ghaa serig daa	BE
nìd grooss brichtet woorde ìsch vilicht bis zume gwüüsse phunkt aber den nümme	BS
mer hend doo das alt huisli echli uisbuije haizig inetaa	LU
jaa wil èr en tüütsche gsii isch und sich iipürgeret hät i de schwiiz	ZH
und was dur daas ou	LU
kärnschtraasschuelhuus	ZH
hät dänn	ZH
und doo seit dää joo das isch i der oornig	BE
und dänn jaa dänn hät me halt au chöne uf d schuelerräis aber	ZH
uf gleitschine aso wi bimene schwääle maschinegweer	BE
aber das händ dänn d schuurnalischten am prozäss zum biischpil isch dä saz wider choo	ZH
me git nìd uuf	LU
es isch de ou esoo daargschteut woorde	BE
zum kafé und die leereri dezue die schniideri	LU
mh	BE
i dère beziejig pitter entüüscht woorde vo de gselschaft	ZH
wǜssder wo d moospinten ìsch deet im vo schüpfe	BE
dise wääg hemmers abprochen und gsait mer gend iich ds trotwaar	LU
das ìsch ja gsìì im im meijje füfevììrzg oder so	BE
die mööglichkhait gää dass si chöne wäärend ire schuelfeerie	BS
naai nai den es ìsch jò esoo gsìì das	BS
isch überhäupt nüüt gsii	ZH
je nei i d i tue daa vììl eso	BE
u den bini zum her könig ggange u hams gseit	BE
und au mit dene hämmir seer vil seer heftigi diskussioone natüürli ghaa und vil vil gleert aso	ZH
und doo ìsch e wachtmäischter gsìì und dää het ghüült	BS
dur e daag	BS
deklariirt woorde	ZH
radikaal voorggange	ZH
ùnd mit der ziit hets ghaisse	LU
also also sii hät	ZH
aber d wäberei isch dänn z änd gsii	BE
sind die obenaabe kho	BS
das sìcher nächer doo het me de scho aarbeit ghaa vo angerne länder oo he	BE
und de häi sìì öisi woonig dö̀rffe benuzen und häi vo baasel iri	BS
mùs vìlecht no voruus schìke	LU
pajonet abgää zum schliife	BE
si doo auti uniforme aber wi mer när du schpööter vernoo het	BE
und ha ne gseit was passiirt isch	BE
u u nachhäre	BE
glueget und	ZH
i de i de alte guete sogenannte guete ziit	ZH
und dasch ales	BS
de buurehoof ufegange und ìsch go sääge	BS
das möcht ich feschthalte	ZH
seer revoluzionär	BS
und hinge no i waud ine	BE
u näär ha ne gseit ja er söu dä grad doo loo das	BE
mir hei nüüt z verteidige üses	BE
mi händ seer vil telefoniert	ZH
ir schwiiz houptsächlich ìsch gsìì vo	BE
ich bin aach ich bi voller elaan gsii und ha gmäint ghaa	ZH
beraits s khüürze vo hoor	BS
und und dehaime sig das sälbverschtäntlich gsi si haiged sich alli	LU
vo vo ormelinge	BS
gaischt und khörper händ	BS
ùnd zwòòr het direkzioon aagoortnet nìd mit maschine sondern mer het si vo hand müsse	LU
me händ au echli liechti hirarchii ghaa zum biischpiil hät s ggää näschtfalke	ZH
mir sind aifach die woo hend chennen us de schuel gsii sind sind go s broot verdienä	LU
auso miir vo de gränzwach	BE
und da han i umgchert u bi haut dert übere	BE
aber die woo vo aafang aa si gsìì die hei tuused dienschttage hei die gmacht im schtrou	BE
befürchtige glaub i ime gewisse sinn scho	BS
das het me scho mèrkt jä	BS
im juni nünzehundertdreiedriissg sind föiftuusig im	ZH
vergwaltige verbräne zum zuug uus gheije	ZH
dòò wo miir jez grad wonid sind aues pflanzgäärte gsii	LU
dò hèt me so bizli sandsegg im züüg inne ghaa ùnd	BS
stoorchegass innere chinderkliinik das isch	ZH
militäärfuerpaark go aaluege	BE
dò het si zu de het si irgend öpperem öpper	BS
wèrchzüügmaschinefabrik püürli	ZH
irgendwie het das nid funkzioniirt	BE
grüess ìsch guet dasch ir oornig grüess vo hand grüesse	BE
den chemii chöne si nìt schtudiere ooni laaborthèètikhait nìt ùnd zwoor vo aafang aa nìt	BS
und si wüssi äu nöd uf ales antwort und das hät mini mueter mir schtändig gsäit hör emal uuf frö̀ö̀ge das wäiss ich ä nööd	ZH
s hèt äu nüüt z mùùre gää das me sich hèt mese khaal schèère	BS
mi dööfed ez nid dienscht verwäigere miir müend	ZH
es würklich si sind	ZH
mir hät de her etter	ZH
e pruef für mii hä	BE
gschänkt ǜǜberchoo vom armeekomando uus	BS
kwaasi uf die aart häi mìr gwüsst das es ganz	BS
